[
  {
    "checklist_id": "cat_cough_triage",
    "species": "cat",
    "chief_complaint": "cough",
    "required_items": [
      {
        "item_id": "open_mouth_breathing",
        "label": "Open mouth breathing",
        "type": "boolean",
        "value": null,
        "confidence": "unknown",
        "source": "user_input",
        "asked_count": 0,
        "question_text": "고양이가 지금 입을 벌리고 숨을 쉬고 있나요?",
        "priority": 1,
        "metadata": {
          "red_flag": true,
          "question_group": "respiratory_distress",
          "question_limit_contract": "max_2_total_safety_questions"
        }
      },
      {
        "item_id": "labored_breathing",
        "label": "Labored breathing",
        "type": "boolean",
        "value": null,
        "confidence": "unknown",
        "source": "user_input",
        "asked_count": 0,
        "question_text": "고양이가 숨쉬기 힘들어 보이나요?",
        "priority": 1,
        "metadata": {
          "red_flag": true,
          "question_group": "respiratory_distress",
          "question_limit_contract": "max_2_total_safety_questions"
        }
      },
      {
        "item_id": "gum_color_abnormal",
        "label": "Pale, blue, purple, or gray gums or tongue",
        "type": "boolean",
        "value": null,
        "confidence": "unknown",
        "source": "user_input",
        "asked_count": 0,
        "question_text": "잇몸이나 혀가 창백하거나 파랗거나 보라색 또는 회색으로 보이나요?",
        "priority": 1,
        "metadata": {
          "red_flag": true,
          "question_group": "oxygenation",
          "question_limit_contract": "max_2_total_safety_questions"
        }
      },
      {
        "item_id": "collapse_or_fainting",
        "label": "Collapse or fainting",
        "type": "boolean",
        "value": null,
        "confidence": "unknown",
        "source": "user_input",
        "asked_count": 0,
        "question_text": "고양이가 쓰러졌거나, 실신했거나, 서 있지 못한 적이 있나요?",
        "priority": 2,
        "metadata": {
          "red_flag": true,
          "question_group": "collapse",
          "question_limit_contract": "max_2_total_safety_questions"
        }
      },
      {
        "item_id": "lethargy",
        "label": "Lethargy",
        "type": "boolean",
        "value": null,
        "confidence": "unknown",
        "source": "user_input",
        "asked_count": 0,
        "question_text": "고양이가 평소보다 유난히 힘이 없거나 반응이 많이 둔한가요?",
        "priority": 3,
        "metadata": {
          "red_flag": true,
          "question_group": "general_condition",
          "question_limit_contract": "max_2_total_safety_questions"
        }
      }
    ],
    "optional_items": [
      {
        "item_id": "duration_hours",
        "label": "Symptom duration in hours",
        "type": "number",
        "value": null,
        "confidence": "unknown",
        "source": "user_input",
        "asked_count": 0,
        "unit": "hours",
        "question_text": "기침은 대략 몇 시간 전부터 시작됐나요?",
        "priority": 5,
        "metadata": {
          "red_flag": false,
          "question_group": "duration",
          "question_limit_contract": "max_2_total_safety_questions"
        }
      }
    ]
  },
  {
    "checklist_id": "dog_cough_triage",
    "species": "dog",
    "chief_complaint": "cough",
    "required_items": [
      {
        "item_id": "labored_breathing",
        "label": "Labored breathing",
        "type": "boolean",
        "value": null,
        "confidence": "unknown",
        "source": "user_input",
        "asked_count": 0,
        "question_text": "강아지가 숨쉬기 힘들어 보이나요?",
        "priority": 1,
        "metadata": {
          "red_flag": true,
          "question_group": "respiratory_distress",
          "question_limit_contract": "max_2_total_safety_questions"
        }
      },
      {
        "item_id": "gum_color_abnormal",
        "label": "Pale, blue, purple, or gray gums or tongue",
        "type": "boolean",
        "value": null,
        "confidence": "unknown",
        "source": "user_input",
        "asked_count": 0,
        "question_text": "잇몸이나 혀가 창백하거나 파랗거나 보라색 또는 회색으로 보이나요?",
        "priority": 1,
        "metadata": {
          "red_flag": true,
          "question_group": "oxygenation",
          "question_limit_contract": "max_2_total_safety_questions"
        }
      },
      {
        "item_id": "collapse_or_fainting",
        "label": "Collapse or fainting",
        "type": "boolean",
        "value": null,
        "confidence": "unknown",
        "source": "user_input",
        "asked_count": 0,
        "question_text": "강아지가 쓰러졌거나, 실신했거나, 서 있지 못한 적이 있나요?",
        "priority": 1,
        "metadata": {
          "red_flag": true,
          "question_group": "collapse",
          "question_limit_contract": "max_2_total_safety_questions"
        }
      },
      {
        "item_id": "repeated_coughing",
        "label": "Repeated coughing",
        "type": "boolean",
        "value": null,
        "confidence": "unknown",
        "source": "user_input",
        "asked_count": 0,
        "question_text": "기침이 반복되거나 발작처럼 자주 이어지나요?",
        "priority": 2,
        "metadata": {
          "red_flag": true,
          "question_group": "symptom_severity",
          "question_limit_contract": "max_2_total_safety_questions"
        }
      },
      {
        "item_id": "lethargy",
        "label": "Lethargy",
        "type": "boolean",
        "value": null,
        "confidence": "unknown",
        "source": "user_input",
        "asked_count": 0,
        "question_text": "강아지가 평소보다 유난히 힘이 없거나 반응이 많이 둔한가요?",
        "priority": 3,
        "metadata": {
          "red_flag": true,
          "question_group": "general_condition",
          "question_limit_contract": "max_2_total_safety_questions"
        }
      }
    ],
    "optional_items": [
      {
        "item_id": "duration_hours",
        "label": "Symptom duration in hours",
        "type": "number",
        "value": null,
        "confidence": "unknown",
        "source": "user_input",
        "asked_count": 0,
        "unit": "hours",
        "question_text": "기침은 대략 몇 시간 전부터 시작됐나요?",
        "priority": 5,
        "metadata": {
          "red_flag": false,
          "question_group": "duration",
          "question_limit_contract": "max_2_total_safety_questions"
        }
      }
    ]
  },
  {
    "checklist_id": "vomiting_triage",
    "species": "cat/dog",
    "chief_complaint": "vomiting",
    "required_items": [
      {
        "item_id": "repeated_vomiting",
        "label": "Repeated vomiting",
        "type": "boolean",
        "value": null,
        "confidence": "unknown",
        "source": "user_input",
        "asked_count": 0,
        "question_text": "반려동물이 반복해서 토하거나 음식이나 물을 먹어도 계속 토하나요?",
        "priority": 1,
        "metadata": {
          "red_flag": true,
          "question_group": "gi_severity",
          "question_limit_contract": "max_2_total_safety_questions"
        }
      },
      {
        "item_id": "blood_in_vomit",
        "label": "Blood in vomit",
        "type": "boolean",
        "value": null,
        "confidence": "unknown",
        "source": "user_input",
        "asked_count": 0,
        "question_text": "토사물에 피가 보이거나 커피 찌꺼기처럼 어두운 물질이 보였나요?",
        "priority": 1,
        "metadata": {
          "red_flag": true,
          "question_group": "bleeding",
          "question_limit_contract": "max_2_total_safety_questions"
        }
      },
      {
        "item_id": "lethargy",
        "label": "Lethargy",
        "type": "boolean",
        "value": null,
        "confidence": "unknown",
        "source": "user_input",
        "asked_count": 0,
        "question_text": "반려동물이 평소보다 유난히 힘이 없거나 반응이 많이 둔한가요?",
        "priority": 2,
        "metadata": {
          "red_flag": true,
          "question_group": "general_condition",
          "question_limit_contract": "max_2_total_safety_questions"
        }
      },
      {
        "item_id": "abdominal_pain",
        "label": "Abdominal pain",
        "type": "boolean",
        "value": null,
        "confidence": "unknown",
        "source": "user_input",
        "asked_count": 0,
        "question_text": "배를 아파하거나, 등을 구부리거나, 몸이 긴장되어 있거나, 만지는 것을 싫어하나요?",
        "priority": 2,
        "metadata": {
          "red_flag": true,
          "question_group": "pain",
          "question_limit_contract": "max_2_total_safety_questions"
        }
      },
      {
        "item_id": "suspected_toxin",
        "label": "Suspected toxin exposure",
        "type": "boolean",
        "value": null,
        "confidence": "unknown",
        "source": "user_input",
        "asked_count": 0,
        "question_text": "약, 화학물질, 독성이 있는 음식이나 식물, 또는 위험할 수 있는 물건을 먹었을 가능성이 있나요?",
        "priority": 1,
        "metadata": {
          "red_flag": true,
          "question_group": "toxicity",
          "question_limit_contract": "max_2_total_safety_questions"
        }
      }
    ],
    "optional_items": [
      {
        "item_id": "duration_hours",
        "label": "Symptom duration in hours",
        "type": "number",
        "value": null,
        "confidence": "unknown",
        "source": "user_input",
        "asked_count": 0,
        "unit": "hours",
        "question_text": "구토는 대략 몇 시간 전부터 시작됐나요?",
        "priority": 5,
        "metadata": {
          "red_flag": false,
          "question_group": "duration",
          "question_limit_contract": "max_2_total_safety_questions"
        }
      }
    ]
  },
  {
    "checklist_id": "diarrhea_triage",
    "species": "cat/dog",
    "chief_complaint": "diarrhea",
    "required_items": [
      {
        "item_id": "bloody_diarrhea",
        "label": "Bloody diarrhea",
        "type": "boolean",
        "value": null,
        "confidence": "unknown",
        "source": "user_input",
        "asked_count": 0,
        "question_text": "대변에 피가 보이거나 검은 타르 같은 변을 봤나요?",
        "priority": 1,
        "metadata": {
          "red_flag": true,
          "question_group": "bleeding",